{
  "schemaVersion": 1,
  "runId": "run_20260908_abc123",
  "sessionId": "ses_lot5_demo",
  "startedAt": "2026-09-08T09:01:00.000Z",
  "finishedAt": "2026-09-08T09:01:02.000Z",
  "exitCode": 0,
  "headless": true,
  "aiRecovery": false,
  "maxAiRetries": 3,
  "smartModel": "claude-sonnet-4-5-20250929",
  "multimodal": true,
  "warnings": [],
  "steps": [
    {
      "index": 0,
      "intent": "Je clique sur Démarrer",
      "status": "passed",
      "durationMs": 120,
      "mode": "script",
      "attempts": 1,
      "verificationOk": true
    }
  ]
}
